"state","state1","zip","DOB","planname","FW"
"Illinois","IL","60629","03/06/1985","Foundation Dental - Protector I","Any person who knowingly and with intent to defraud any insurance company or other person, files an application for insurance or statement of claim containing any materially false information or conceals for the purpose of misleading, information concerning any fact material thereto commits a fraudulent insurance act, which is a crime and subjects such person to criminal and/or civil penalties."
"Alabama","AL","35216","03/06/1985","Foundation Dental - Defender","Any person who knowingly presents a false or fraudulent claim for payment of a loss or benefit or who knowingly presents false information in an application for insurance is guilty of a crime and may be subject to restitution fines or confinement in prison, or any combination thereof."
"Louisiana","LA","70816","03/06/1985","Foundation Dental - Protector I and Foundation Vision","Any person who knowingly presents a false or fraudulent claim for payment of a loss or benefit or knowingly presents false information in an application for insurance is guilty of a crime and may be subject to fines and confinement in prison."
"Tennessee","TN","37230","03/06/1985","Foundation Dental - Guardian","It is a crime to knowingly provide false, incomplete or misleading information to an insurance company for the purpose of defrauding the company. Penalties include imprisonment, fines and denial of insurance benefits."
"##Washington","WA","98115","03/06/1985","Foundation Dental - Defender and Foundation Vision","Any person who knowingly presents a false or fraudulent claim for payment of a loss or knowingly makes a false statement in an application for insurance may be guilty of a criminal offense under state law."
"Virginia","UT","84120","03/06/1985","Foundation Dental - Guardian","Any person who knowingly presents false or fraudulent underwriting information, files or causes to be filed a false or fraudulent claim for disability compensation or medical benefits, or submits a false or fraudulent report or billing for health care fees or other professional services is guilty of a crime and may be subject to fines and confinement in state prison."
